A1: 唯一识别码 | B1: 设备专有名称 | C1: 线别代码 | D1: 应用线别 | E1: 线段代码 | F1: 应用线段 | G1: 位置类型 | H1: 位置一 | I1: 位置二 | J1: 位置三 | K1: 位置2代码 | L1: 所属专业 | M1: 专业名称 | N1: 所属专业系统 | O1: 系统名称 | P1: 设备分类代码 | Q1: 设备分类名称 | R1: 数量 | S1: 单位(库存) | T1: 是否设备树展示 | U1: 资产代码 | V1: 物资名称 | W1: 型号规格 | X1: 品牌 | Y1: 设备状态 | Z1: 合同号 | AA1: 使用责任人 | AB1: 使用权属单位 | AC1: 备注（设备）
A2: 1001679454 | B2: 10701 | C2: ="10" -> 10 | D2: ="10号线" -> 10号线 | E2: ="3" -> 3 | F2: ="三期" -> 三期 | G2: ="C10001001" -> C10001001 | H2: ="车辆段" -> 车辆段 | I2: =" " ->  | J2: =" " ->  | K2: =" " ->  | L2: ="0352" -> 0352 | M2: ="电客车" -> 电客车 | N2: ="0352001" -> 0352001 | O2: ="电客车" -> 电客车 | P2: ="0352001001" -> 0352001001 | Q2: ="电客车" -> 电客车 | R2: 1 | S2: ="列" -> 列 | T2: ="Y" -> Y | U2: ="15049934" -> 15049934 | V2: ="电客车" -> 电客车 | W2: ="SFM46" -> SFM46 | X2: ="中车四方" -> 中车四方 | Y2: ="N" -> N | Z2: ="101D0075-2015-033-CG001" -> 101D0075-2015-033-CG001 | AA2: =" " ->  | AB2: =" " ->  | AC2: =" " -> 
A3: 1001679455 | B3: 10702 | C3: ="10" -> 10 | D3: ="10号线" -> 10号线 | E3: ="3" -> 3 | F3: ="三期" -> 三期 | G3: ="C10001001" -> C10001001 | H3: ="车辆段" -> 车辆段 | I3: =" " ->  | J3: =" " ->  | K3: =" " ->  | L3: ="0352" -> 0352 | M3: ="电客车" -> 电客车 | N3: ="0352001" -> 0352001 | O3: ="电客车" -> 电客车 | P3: ="0352001001" -> 0352001001 | Q3: ="电客车" -> 电客车 | R3: 1 | S3: ="列" -> 列 | T3: ="Y" -> Y | U3: ="15049934" -> 15049934 | V3: ="电客车" -> 电客车 | W3: ="SFM46" -> SFM46 | X3: ="中车四方" -> 中车四方 | Y3: ="N" -> N | Z3: ="101D0075-2015-033-CG001" -> 101D0075-2015-033-CG001 | AA3: =" " ->  | AB3: =" " ->  | AC3: =" " -> 
A4: 1001679456 | B4: 10703 | C4: ="10" -> 10 | D4: ="10号线" -> 10号线 | E4: ="3" -> 3 | F4: ="三期" -> 三期 | G4: ="C10001001" -> C10001001 | H4: ="车辆段" -> 车辆段 | I4: =" " ->  | J4: =" " ->  | K4: =" " ->  | L4: ="0352" -> 0352 | M4: ="电客车" -> 电客车 | N4: ="0352001" -> 0352001 | O4: ="电客车" -> 电客车 | P4: ="0352001001" -> 0352001001 | Q4: ="电客车" -> 电客车 | R4: 1 | S4: ="列" -> 列 | T4: ="Y" -> Y | U4: ="15049934" -> 15049934 | V4: ="电客车" -> 电客车 | W4: ="SFM46" -> SFM46 | X4: ="中车四方" -> 中车四方 | Y4: ="N" -> N | Z4: ="101D0075-2015-033-CG001" -> 101D0075-2015-033-CG001 | AA4: =" " ->  | AB4: =" " ->  | AC4: =" " -> 
A5: 1001679457 | B5: 10704 | C5: ="10" -> 10 | D5: ="10号线" -> 10号线 | E5: ="3" -> 3 | F5: ="三期" -> 三期 | G5: ="C10001001" -> C10001001 | H5: ="车辆段" -> 车辆段 | I5: =" " ->  | J5: =" " ->  | K5: =" " ->  | L5: ="0352" -> 0352 | M5: ="电客车" -> 电客车 | N5: ="0352001" -> 0352001 | O5: ="电客车" -> 电客车 | P5: ="0352001001" -> 0352001001 | Q5: ="电客车" -> 电客车 | R5: 1 | S5: ="列" -> 列 | T5: ="Y" -> Y | U5: ="15049934" -> 15049934 | V5: ="电客车" -> 电客车 | W5: ="SFM46" -> SFM46 | X5: ="中车四方" -> 中车四方 | Y5: ="N" -> N | Z5: ="101D0075-2015-033-CG001" -> 101D0075-2015-033-CG001 | AA5: =" " ->  | AB5: =" " ->  | AC5: =" " -> 
A6: 1001679458 | B6: 10705 | C6: ="10" -> 10 | D6: ="10号线" -> 10号线 | E6: ="3" -> 3 | F6: ="三期" -> 三期 | G6: ="C10001001" -> C10001001 | H6: ="车辆段" -> 车辆段 | I6: =" " ->  | J6: =" " ->  | K6: =" " ->  | L6: ="0352" -> 0352 | M6: ="电客车" -> 电客车 | N6: ="0352001" -> 0352001 | O6: ="电客车" -> 电客车 | P6: ="0352001001" -> 0352001001 | Q6: ="电客车" -> 电客车 | R6: 1 | S6: ="列" -> 列 | T6: ="Y" -> Y | U6: ="15049934" -> 15049934 | V6: ="电客车" -> 电客车 | W6: ="SFM46" -> SFM46 | X6: ="中车四方" -> 中车四方 | Y6: ="N" -> N | Z6: ="101D0075-2015-033-CG001" -> 101D0075-2015-033-CG001 | AA6: =" " ->  | AB6: =" " ->  | AC6: =" " -> 
A7: 1001679459 | B7: 10706 | C7: ="10" -> 10 | D7: ="10号线" -> 10号线 | E7: ="3" -> 3 | F7: ="三期" -> 三期 | G7: ="C10001001" -> C10001001 | H7: ="车辆段" -> 车辆段 | I7: =" " ->  | J7: =" " ->  | K7: =" " ->  | L7: ="0352" -> 0352 | M7: ="电客车" -> 电客车 | N7: ="0352001" -> 0352001 | O7: ="电客车" -> 电客车 | P7: ="0352001001" -> 0352001001 | Q7: ="电客车" -> 电客车 | R7: 1 | S7: ="列" -> 列 | T7: ="Y" -> Y | U7: ="15049934" -> 15049934 | V7: ="电客车" -> 电客车 | W7: ="SFM46" -> SFM46 | X7: ="中车四方" -> 中车四方 | Y7: ="N" -> N | Z7: ="101D0075-2015-033-CG001" -> 101D0075-2015-033-CG001 | AA7: =" " ->  | AB7: =" " ->  | AC7: =" " -> 
A8: 1001679460 | B8: 10707 | C8: ="10" -> 10 | D8: ="10号线" -> 10号线 | E8: ="3" -> 3 | F8: ="三期" -> 三期 | G8: ="C10001001" -> C10001001 | H8: ="车辆段" -> 车辆段 | I8: =" " ->  | J8: =" " ->  | K8: =" " ->  | L8: ="0352" -> 0352 | M8: ="电客车" -> 电客车 | N8: ="0352001" -> 0352001 | O8: ="电客车" -> 电客车 | P8: ="0352001001" -> 0352001001 | Q8: ="电客车" -> 电客车 | R8: 1 | S8: ="列" -> 列 | T8: ="Y" -> Y | U8: ="15049934" -> 15049934 | V8: ="电客车" -> 电客车 | W8: ="SFM46" -> SFM46 | X8: ="中车四方" -> 中车四方 | Y8: ="N" -> N | Z8: ="101D0075-2015-033-CG001" -> 101D0075-2015-033-CG001 | AA8: =" " ->  | AB8: =" " ->  | AC8: =" " -> 
A9: 1001679461 | B9: 10708 | C9: ="10" -> 10 | D9: ="10号线" -> 10号线 | E9: ="3" -> 3 | F9: ="三期" -> 三期 | G9: ="C10001001" -> C10001001 | H9: ="车辆段" -> 车辆段 | I9: =" " ->  | J9: =" " ->  | K9: =" " ->  | L9: ="0352" -> 0352 | M9: ="电客车" -> 电客车 | N9: ="0352001" -> 0352001 | O9: ="电客车" -> 电客车 | P9: ="0352001001" -> 0352001001 | Q9: ="电客车" -> 电客车 | R9: 1 | S9: ="列" -> 列 | T9: ="Y" -> Y | U9: ="15049934" -> 15049934 | V9: ="电客车" -> 电客车 | W9: ="SFM46" -> SFM46 | X9: ="中车四方" -> 中车四方 | Y9: ="N" -> N | Z9: ="101D0075-2015-033-CG001" -> 101D0075-2015-033-CG001 | AA9: =" " ->  | AB9: =" " ->  | AC9: =" " -> 
A10: 1001679462 | B10: 10709 | C10: ="10" -> 10 | D10: ="10号线" -> 10号线 | E10: ="3" -> 3 | F10: ="三期" -> 三期 | G10: ="C10001001" -> C10001001 | H10: ="车辆段" -> 车辆段 | I10: =" " ->  | J10: =" " ->  | K10: =" " ->  | L10: ="0352" -> 0352 | M10: ="电客车" -> 电客车 | N10: ="0352001" -> 0352001 | O10: ="电客车" -> 电客车 | P10: ="0352001001" -> 0352001001 | Q10: ="电客车" -> 电客车 | R10: 1 | S10: ="列" -> 列 | T10: ="Y" -> Y | U10: ="15049934" -> 15049934 | V10: ="电客车" -> 电客车 | W10: ="SFM46" -> SFM46 | X10: ="中车四方" -> 中车四方 | Y10: ="N" -> N | Z10: ="101D0075-2015-033-CG001" -> 101D0075-2015-033-CG001 | AA10: =" " ->  | AB10: =" " ->  | AC10: =" " -> 
A11: 1001679463 | B11: 10710 | C11: ="10" -> 10 | D11: ="10号线" -> 10号线 | E11: ="3" -> 3 | F11: ="三期" -> 三期 | G11: ="C10001001" -> C10001001 | H11: ="车辆段" -> 车辆段 | I11: =" " ->  | J11: =" " ->  | K11: =" " ->  | L11: ="0352" -> 0352 | M11: ="电客车" -> 电客车 | N11: ="0352001" -> 0352001 | O11: ="电客车" -> 电客车 | P11: ="0352001001" -> 0352001001 | Q11: ="电客车" -> 电客车 | R11: 1 | S11: ="列" -> 列 | T11: ="Y" -> Y | U11: ="15049934" -> 15049934 | V11: ="电客车" -> 电客车 | W11: ="SFM46" -> SFM46 | X11: ="中车四方" -> 中车四方 | Y11: ="N" -> N | Z11: ="101D0075-2015-033-CG001" -> 101D0075-2015-033-CG001 | AA11: =" " ->  | AB11: =" " ->  | AC11: =" " -> 
A12: 1001679464 | B12: 10711 | C12: ="10" -> 10 | D12: ="10号线" -> 10号线 | E12: ="3" -> 3 | F12: ="三期" -> 三期 | G12: ="C10001001" -> C10001001 | H12: ="车辆段" -> 车辆段 | I12: =" " ->  | J12: =" " ->  | K12: =" " ->  | L12: ="0352" -> 0352 | M12: ="电客车" -> 电客车 | N12: ="0352001" -> 0352001 | O12: ="电客车" -> 电客车 | P12: ="0352001001" -> 0352001001 | Q12: ="电客车" -> 电客车 | R12: 1 | S12: ="列" -> 列 | T12: ="Y" -> Y | U12: ="15049934" -> 15049934 | V12: ="电客车" -> 电客车 | W12: ="SFM46" -> SFM46 | X12: ="中车四方" -> 中车四方 | Y12: ="N" -> N | Z12: ="101D0075-2015-033-CG001" -> 101D0075-2015-033-CG001 | AA12: =" " ->  | AB12: =" " ->  | AC12: =" " -> 
A13: 1001679465 | B13: 10712 | C13: ="10" -> 10 | D13: ="10号线" -> 10号线 | E13: ="3" -> 3 | F13: ="三期" -> 三期 | G13: ="C10001001" -> C10001001 | H13: ="车辆段" -> 车辆段 | I13: =" " ->  | J13: =" " ->  | K13: =" " ->  | L13: ="0352" -> 0352 | M13: ="电客车" -> 电客车 | N13: ="0352001" -> 0352001 | O13: ="电客车" -> 电客车 | P13: ="0352001001" -> 0352001001 | Q13: ="电客车" -> 电客车 | R13: 1 | S13: ="列" -> 列 | T13: ="Y" -> Y | U13: ="15049934" -> 15049934 | V13: ="电客车" -> 电客车 | W13: ="SFM46" -> SFM46 | X13: ="中车四方" -> 中车四方 | Y13: ="N" -> N | Z13: ="101D0075-2015-033-CG001" -> 101D0075-2015-033-CG001 | AA13: =" " ->  | AB13: =" " ->  | AC13: =" " -> 
A14: 1001679466 | B14: 10713 | C14: ="10" -> 10 | D14: ="10号线" -> 10号线 | E14: ="3" -> 3 | F14: ="三期" -> 三期 | G14: ="C10001001" -> C10001001 | H14: ="车辆段" -> 车辆段 | I14: =" " ->  | J14: =" " ->  | K14: =" " ->  | L14: ="0352" -> 0352 | M14: ="电客车" -> 电客车 | N14: ="0352001" -> 0352001 | O14: ="电客车" -> 电客车 | P14: ="0352001001" -> 0352001001 | Q14: ="电客车" -> 电客车 | R14: 1 | S14: ="列" -> 列 | T14: ="Y" -> Y | U14: ="15049934" -> 15049934 | V14: ="电客车" -> 电客车 | W14: ="SFM46" -> SFM46 | X14: ="中车四方" -> 中车四方 | Y14: ="N" -> N | Z14: ="101D0075-2015-033-CG001" -> 101D0075-2015-033-CG001 | AA14: =" " ->  | AB14: =" " ->  | AC14: =" " -> 
A15: 1001679467 | B15: 10714 | C15: ="10" -> 10 | D15: ="10号线" -> 10号线 | E15: ="3" -> 3 | F15: ="三期" -> 三期 | G15: ="C10001001" -> C10001001 | H15: ="车辆段" -> 车辆段 | I15: =" " ->  | J15: =" " ->  | K15: =" " ->  | L15: ="0352" -> 0352 | M15: ="电客车" -> 电客车 | N15: ="0352001" -> 0352001 | O15: ="电客车" -> 电客车 | P15: ="0352001001" -> 0352001001 | Q15: ="电客车" -> 电客车 | R15: 1 | S15: ="列" -> 列 | T15: ="Y" -> Y | U15: ="15049934" -> 15049934 | V15: ="电客车" -> 电客车 | W15: ="SFM46" -> SFM46 | X15: ="中车四方" -> 中车四方 | Y15: ="N" -> N | Z15: ="101D0075-2015-033-CG001" -> 101D0075-2015-033-CG001 | AA15: =" " ->  | AB15: =" " ->  | AC15: =" " -> 
A16: 1001679468 | B16: 10715 | C16: ="10" -> 10 | D16: ="10号线" -> 10号线 | E16: ="3" -> 3 | F16: ="三期" -> 三期 | G16: ="C10001001" -> C10001001 | H16: ="车辆段" -> 车辆段 | I16: =" " ->  | J16: =" " ->  | K16: =" " ->  | L16: ="0352" -> 0352 | M16: ="电客车" -> 电客车 | N16: ="0352001" -> 0352001 | O16: ="电客车" -> 电客车 | P16: ="0352001001" -> 0352001001 | Q16: ="电客车" -> 电客车 | R16: 1 | S16: ="列" -> 列 | T16: ="Y" -> Y | U16: ="15049934" -> 15049934 | V16: ="电客车" -> 电客车 | W16: ="SFM46" -> SFM46 | X16: ="中车四方" -> 中车四方 | Y16: ="N" -> N | Z16: ="101D0075-2015-033-CG001" -> 101D0075-2015-033-CG001 | AA16: =" " ->  | AB16: =" " ->  | AC16: =" " -> 
A17: 1001679469 | B17: 10716 | C17: ="10" -> 10 | D17: ="10号线" -> 10号线 | E17: ="3" -> 3 | F17: ="三期" -> 三期 | G17: ="C10001001" -> C10001001 | H17: ="车辆段" -> 车辆段 | I17: =" " ->  | J17: =" " ->  | K17: =" " ->  | L17: ="0352" -> 0352 | M17: ="电客车" -> 电客车 | N17: ="0352001" -> 0352001 | O17: ="电客车" -> 电客车 | P17: ="0352001001" -> 0352001001 | Q17: ="电客车" -> 电客车 | R17: 1 | S17: ="列" -> 列 | T17: ="Y" -> Y | U17: ="15049934" -> 15049934 | V17: ="电客车" -> 电客车 | W17: ="SFM46" -> SFM46 | X17: ="中车四方" -> 中车四方 | Y17: ="N" -> N | Z17: ="101D0075-2015-033-CG001" -> 101D0075-2015-033-CG001 | AA17: =" " ->  | AB17: =" " ->  | AC17: =" " -> 
A18: 1001679470 | B18: 10717 | C18: ="10" -> 10 | D18: ="10号线" -> 10号线 | E18: ="3" -> 3 | F18: ="三期" -> 三期 | G18: ="C10001001" -> C10001001 | H18: ="车辆段" -> 车辆段 | I18: =" " ->  | J18: =" " ->  | K18: =" " ->  | L18: ="0352" -> 0352 | M18: ="电客车" -> 电客车 | N18: ="0352001" -> 0352001 | O18: ="电客车" -> 电客车 | P18: ="0352001001" -> 0352001001 | Q18: ="电客车" -> 电客车 | R18: 1 | S18: ="列" -> 列 | T18: ="Y" -> Y | U18: ="15049934" -> 15049934 | V18: ="电客车" -> 电客车 | W18: ="SFM46" -> SFM46 | X18: ="中车四方" -> 中车四方 | Y18: ="N" -> N | Z18: ="101D0075-2015-033-CG001" -> 101D0075-2015-033-CG001 | AA18: =" " ->  | AB18: =" " ->  | AC18: =" " -> 
A19: 1001679471 | B19: 10718 | C19: ="10" -> 10 | D19: ="10号线" -> 10号线 | E19: ="3" -> 3 | F19: ="三期" -> 三期 | G19: ="C10001001" -> C10001001 | H19: ="车辆段" -> 车辆段 | I19: =" " ->  | J19: =" " ->  | K19: =" " ->  | L19: ="0352" -> 0352 | M19: ="电客车" -> 电客车 | N19: ="0352001" -> 0352001 | O19: ="电客车" -> 电客车 | P19: ="0352001001" -> 0352001001 | Q19: ="电客车" -> 电客车 | R19: 1 | S19: ="列" -> 列 | T19: ="Y" -> Y | U19: ="15049934" -> 15049934 | V19: ="电客车" -> 电客车 | W19: ="SFM46" -> SFM46 | X19: ="中车四方" -> 中车四方 | Y19: ="N" -> N | Z19: ="101D0075-2015-033-CG001" -> 101D0075-2015-033-CG001 | AA19: =" " ->  | AB19: =" " ->  | AC19: =" " -> 
A20: 1001679472 | B20: 10719 | C20: ="10" -> 10 | D20: ="10号线" -> 10号线 | E20: ="3" -> 3 | F20: ="三期" -> 三期 | G20: ="C10001001" -> C10001001 | H20: ="车辆段" -> 车辆段 | I20: =" " ->  | J20: =" " ->  | K20: =" " ->  | L20: ="0352" -> 0352 | M20: ="电客车" -> 电客车 | N20: ="0352001" -> 0352001 | O20: ="电客车" -> 电客车 | P20: ="0352001001" -> 0352001001 | Q20: ="电客车" -> 电客车 | R20: 1 | S20: ="列" -> 列 | T20: ="Y" -> Y | U20: ="15049934" -> 15049934 | V20: ="电客车" -> 电客车 | W20: ="SFM46" -> SFM46 | X20: ="中车四方" -> 中车四方 | Y20: ="N" -> N | Z20: ="101D0075-2015-033-CG001" -> 101D0075-2015-033-CG001 | AA20: =" " ->  | AB20: =" " ->  | AC20: =" " -> 
A21: 1001679473 | B21: 10720 | C21: ="10" -> 10 | D21: ="10号线" -> 10号线 | E21: ="3" -> 3 | F21: ="三期" -> 三期 | G21: ="C10001001" -> C10001001 | H21: ="车辆段" -> 车辆段 | I21: =" " ->  | J21: =" " ->  | K21: =" " ->  | L21: ="0352" -> 0352 | M21: ="电客车" -> 电客车 | N21: ="0352001" -> 0352001 | O21: ="电客车" -> 电客车 | P21: ="0352001001" -> 0352001001 | Q21: ="电客车" -> 电客车 | R21: 1 | S21: ="列" -> 列 | T21: ="Y" -> Y | U21: ="15049934" -> 15049934 | V21: ="电客车" -> 电客车 | W21: ="SFM46" -> SFM46 | X21: ="中车四方" -> 中车四方 | Y21: ="N" -> N | Z21: ="101D0075-2015-033-CG001" -> 101D0075-2015-033-CG001 | AA21: =" " ->  | AB21: =" " ->  | AC21: =" " -> 
A22: 1001679474 | B22: 10721 | C22: ="10" -> 10 | D22: ="10号线" -> 10号线 | E22: ="3" -> 3 | F22: ="三期" -> 三期 | G22: ="C10001001" -> C10001001 | H22: ="车辆段" -> 车辆段 | I22: =" " ->  | J22: =" " ->  | K22: =" " ->  | L22: ="0352" -> 0352 | M22: ="电客车" -> 电客车 | N22: ="0352001" -> 0352001 | O22: ="电客车" -> 电客车 | P22: ="0352001001" -> 0352001001 | Q22: ="电客车" -> 电客车 | R22: 1 | S22: ="列" -> 列 | T22: ="Y" -> Y | U22: ="15049934" -> 15049934 | V22: ="电客车" -> 电客车 | W22: ="SFM46" -> SFM46 | X22: ="中车四方" -> 中车四方 | Y22: ="N" -> N | Z22: ="101D0075-2015-033-CG001" -> 101D0075-2015-033-CG001 | AA22: =" " ->  | AB22: =" " ->  | AC22: =" " -> 
A23: 1001679475 | B23: 10722 | C23: ="10" -> 10 | D23: ="10号线" -> 10号线 | E23: ="3" -> 3 | F23: ="三期" -> 三期 | G23: ="C10001001" -> C10001001 | H23: ="车辆段" -> 车辆段 | I23: =" " ->  | J23: =" " ->  | K23: =" " ->  | L23: ="0352" -> 0352 | M23: ="电客车" -> 电客车 | N23: ="0352001" -> 0352001 | O23: ="电客车" -> 电客车 | P23: ="0352001001" -> 0352001001 | Q23: ="电客车" -> 电客车 | R23: 1 | S23: ="列" -> 列 | T23: ="Y" -> Y | U23: ="15049934" -> 15049934 | V23: ="电客车" -> 电客车 | W23: ="SFM46" -> SFM46 | X23: ="中车四方" -> 中车四方 | Y23: ="N" -> N | Z23: ="101D0075-2015-033-CG001" -> 101D0075-2015-033-CG001 | AA23: =" " ->  | AB23: =" " ->  | AC23: =" " -> 
A24: 1001679476 | B24: 10723 | C24: ="10" -> 10 | D24: ="10号线" -> 10号线 | E24: ="3" -> 3 | F24: ="三期" -> 三期 | G24: ="C10001001" -> C10001001 | H24: ="车辆段" -> 车辆段 | I24: =" " ->  | J24: =" " ->  | K24: =" " ->  | L24: ="0352" -> 0352 | M24: ="电客车" -> 电客车 | N24: ="0352001" -> 0352001 | O24: ="电客车" -> 电客车 | P24: ="0352001001" -> 0352001001 | Q24: ="电客车" -> 电客车 | R24: 1 | S24: ="列" -> 列 | T24: ="Y" -> Y | U24: ="15049934" -> 15049934 | V24: ="电客车" -> 电客车 | W24: ="SFM46" -> SFM46 | X24: ="中车四方" -> 中车四方 | Y24: ="N" -> N | Z24: ="101D0075-2015-033-CG001" -> 101D0075-2015-033-CG001 | AA24: =" " ->  | AB24: =" " ->  | AC24: =" " -> 
A25: 1001679477 | B25: 10724 | C25: ="10" -> 10 | D25: ="10号线" -> 10号线 | E25: ="3" -> 3 | F25: ="三期" -> 三期 | G25: ="C10001001" -> C10001001 | H25: ="车辆段" -> 车辆段 | I25: =" " ->  | J25: =" " ->  | K25: =" " ->  | L25: ="0352" -> 0352 | M25: ="电客车" -> 电客车 | N25: ="0352001" -> 0352001 | O25: ="电客车" -> 电客车 | P25: ="0352001001" -> 0352001001 | Q25: ="电客车" -> 电客车 | R25: 1 | S25: ="列" -> 列 | T25: ="Y" -> Y | U25: ="15049934" -> 15049934 | V25: ="电客车" -> 电客车 | W25: ="SFM46" -> SFM46 | X25: ="中车四方" -> 中车四方 | Y25: ="N" -> N | Z25: ="101D0075-2015-033-CG001" -> 101D0075-2015-033-CG001 | AA25: =" " ->  | AB25: =" " ->  | AC25: =" " -> 
A26: 1001679478 | B26: 10725 | C26: ="10" -> 10 | D26: ="10号线" -> 10号线 | E26: ="3" -> 3 | F26: ="三期" -> 三期 | G26: ="C10001001" -> C10001001 | H26: ="车辆段" -> 车辆段 | I26: =" " ->  | J26: =" " ->  | K26: =" " ->  | L26: ="0352" -> 0352 | M26: ="电客车" -> 电客车 | N26: ="0352001" -> 0352001 | O26: ="电客车" -> 电客车 | P26: ="0352001001" -> 0352001001 | Q26: ="电客车" -> 电客车 | R26: 1 | S26: ="列" -> 列 | T26: ="Y" -> Y | U26: ="15049934" -> 15049934 | V26: ="电客车" -> 电客车 | W26: ="SFM46" -> SFM46 | X26: ="中车四方" -> 中车四方 | Y26: ="N" -> N | Z26: ="101D0075-2015-033-CG001" -> 101D0075-2015-033-CG001 | AA26: =" " ->  | AB26: =" " ->  | AC26: =" " -> 
A27: 1001679479 | B27: 10726 | C27: ="10" -> 10 | D27: ="10号线" -> 10号线 | E27: ="3" -> 3 | F27: ="三期" -> 三期 | G27: ="C10001001" -> C10001001 | H27: ="车辆段" -> 车辆段 | I27: =" " ->  | J27: =" " ->  | K27: =" " ->  | L27: ="0352" -> 0352 | M27: ="电客车" -> 电客车 | N27: ="0352001" -> 0352001 | O27: ="电客车" -> 电客车 | P27: ="0352001001" -> 0352001001 | Q27: ="电客车" -> 电客车 | R27: 1 | S27: ="列" -> 列 | T27: ="Y" -> Y | U27: ="15049934" -> 15049934 | V27: ="电客车" -> 电客车 | W27: ="SFM46" -> SFM46 | X27: ="中车四方" -> 中车四方 | Y27: ="N" -> N | Z27: ="101D0075-2015-033-CG001" -> 101D0075-2015-033-CG001 | AA27: =" " ->  | AB27: =" " ->  | AC27: =" " -> 
A28: 1001679480 | B28: 10727 | C28: ="10" -> 10 | D28: ="10号线" -> 10号线 | E28: ="3" -> 3 | F28: ="三期" -> 三期 | G28: ="C10001001" -> C10001001 | H28: ="车辆段" -> 车辆段 | I28: =" " ->  | J28: =" " ->  | K28: =" " ->  | L28: ="0352" -> 0352 | M28: ="电客车" -> 电客车 | N28: ="0352001" -> 0352001 | O28: ="电客车" -> 电客车 | P28: ="0352001001" -> 0352001001 | Q28: ="电客车" -> 电客车 | R28: 1 | S28: ="列" -> 列 | T28: ="Y" -> Y | U28: ="15049934" -> 15049934 | V28: ="电客车" -> 电客车 | W28: ="SFM46" -> SFM46 | X28: ="中车四方" -> 中车四方 | Y28: ="N" -> N | Z28: ="101D0075-2015-033-CG001" -> 101D0075-2015-033-CG001 | AA28: =" " ->  | AB28: =" " ->  | AC28: =" " -> 
A29: 1001679481 | B29: 10728 | C29: ="10" -> 10 | D29: ="10号线" -> 10号线 | E29: ="3" -> 3 | F29: ="三期" -> 三期 | G29: ="C10001001" -> C10001001 | H29: ="车辆段" -> 车辆段 | I29: =" " ->  | J29: =" " ->  | K29: =" " ->  | L29: ="0352" -> 0352 | M29: ="电客车" -> 电客车 | N29: ="0352001" -> 0352001 | O29: ="电客车" -> 电客车 | P29: ="0352001001" -> 0352001001 | Q29: ="电客车" -> 电客车 | R29: 1 | S29: ="列" -> 列 | T29: ="Y" -> Y | U29: ="15049934" -> 15049934 | V29: ="电客车" -> 电客车 | W29: ="SFM46" -> SFM46 | X29: ="中车四方" -> 中车四方 | Y29: ="N" -> N | Z29: ="101D0075-2015-033-CG001" -> 101D0075-2015-033-CG001 | AA29: =" " ->  | AB29: =" " ->  | AC29: =" " -> 
A30: 1001679482 | B30: 10729 | C30: ="10" -> 10 | D30: ="10号线" -> 10号线 | E30: ="3" -> 3 | F30: ="三期" -> 三期 | G30: ="C10001001" -> C10001001 | H30: ="车辆段" -> 车辆段 | I30: =" " ->  | J30: =" " ->  | K30: =" " ->  | L30: ="0352" -> 0352 | M30: ="电客车" -> 电客车 | N30: ="0352001" -> 0352001 | O30: ="电客车" -> 电客车 | P30: ="0352001001" -> 0352001001 | Q30: ="电客车" -> 电客车 | R30: 1 | S30: ="列" -> 列 | T30: ="Y" -> Y | U30: ="15049934" -> 15049934 | V30: ="电客车" -> 电客车 | W30: ="SFM46" -> SFM46 | X30: ="中车四方" -> 中车四方 | Y30: ="N" -> N | Z30: ="101D0075-2015-033-CG001" -> 101D0075-2015-033-CG001 | AA30: =" " ->  | AB30: =" " ->  | AC30: =" " -> 
A31: 1001679483 | B31: 10730 | C31: ="10" -> 10 | D31: ="10号线" -> 10号线 | E31: ="3" -> 3 | F31: ="三期" -> 三期 | G31: ="C10001001" -> C10001001 | H31: ="车辆段" -> 车辆段 | I31: =" " ->  | J31: =" " ->  | K31: =" " ->  | L31: ="0352" -> 0352 | M31: ="电客车" -> 电客车 | N31: ="0352001" -> 0352001 | O31: ="电客车" -> 电客车 | P31: ="0352001001" -> 0352001001 | Q31: ="电客车" -> 电客车 | R31: 1 | S31: ="列" -> 列 | T31: ="Y" -> Y | U31: ="15049934" -> 15049934 | V31: ="电客车" -> 电客车 | W31: ="SFM46" -> SFM46 | X31: ="中车四方" -> 中车四方 | Y31: ="N" -> N | Z31: ="101D0075-2015-033-CG001" -> 101D0075-2015-033-CG001 | AA31: =" " ->  | AB31: =" " ->  | AC31: =" " -> 
A32: 1001679484 | B32: 10731 | C32: ="10" -> 10 | D32: ="10号线" -> 10号线 | E32: ="3" -> 3 | F32: ="三期" -> 三期 | G32: ="C10001001" -> C10001001 | H32: ="车辆段" -> 车辆段 | I32: =" " ->  | J32: =" " ->  | K32: =" " ->  | L32: ="0352" -> 0352 | M32: ="电客车" -> 电客车 | N32: ="0352001" -> 0352001 | O32: ="电客车" -> 电客车 | P32: ="0352001001" -> 0352001001 | Q32: ="电客车" -> 电客车 | R32: 1 | S32: ="列" -> 列 | T32: ="Y" -> Y | U32: ="15049934" -> 15049934 | V32: ="电客车" -> 电客车 | W32: ="SFM46" -> SFM46 | X32: ="中车四方" -> 中车四方 | Y32: ="N" -> N | Z32: ="101D0075-2015-033-CG001" -> 101D0075-2015-033-CG001 | AA32: =" " ->  | AB32: =" " ->  | AC32: =" " -> 
A33: 1001679485 | B33: 10732 | C33: ="10" -> 10 | D33: ="10号线" -> 10号线 | E33: ="3" -> 3 | F33: ="三期" -> 三期 | G33: ="C10001001" -> C10001001 | H33: ="车辆段" -> 车辆段 | I33: =" " ->  | J33: =" " ->  | K33: =" " ->  | L33: ="0352" -> 0352 | M33: ="电客车" -> 电客车 | N33: ="0352001" -> 0352001 | O33: ="电客车" -> 电客车 | P33: ="0352001001" -> 0352001001 | Q33: ="电客车" -> 电客车 | R33: 1 | S33: ="列" -> 列 | T33: ="Y" -> Y | U33: ="15049934" -> 15049934 | V33: ="电客车" -> 电客车 | W33: ="SFM46" -> SFM46 | X33: ="中车四方" -> 中车四方 | Y33: ="N" -> N | Z33: ="101D0075-2015-033-CG001" -> 101D0075-2015-033-CG001 | AA33: =" " ->  | AB33: =" " ->  | AC33: =" " -> 
A34: 1001679486 | B34: 10733 | C34: ="10" -> 10 | D34: ="10号线" -> 10号线 | E34: ="3" -> 3 | F34: ="三期" -> 三期 | G34: ="C10001001" -> C10001001 | H34: ="车辆段" -> 车辆段 | I34: =" " ->  | J34: =" " ->  | K34: =" " ->  | L34: ="0352" -> 0352 | M34: ="电客车" -> 电客车 | N34: ="0352001" -> 0352001 | O34: ="电客车" -> 电客车 | P34: ="0352001001" -> 0352001001 | Q34: ="电客车" -> 电客车 | R34: 1 | S34: ="列" -> 列 | T34: ="Y" -> Y | U34: ="15049934" -> 15049934 | V34: ="电客车" -> 电客车 | W34: ="SFM46" -> SFM46 | X34: ="中车四方" -> 中车四方 | Y34: ="N" -> N | Z34: ="101D0075-2015-033-CG001" -> 101D0075-2015-033-CG001 | AA34: =" " ->  | AB34: =" " ->  | AC34: =" " -> 
A35: 1001679487 | B35: 10734 | C35: ="10" -> 10 | D35: ="10号线" -> 10号线 | E35: ="3" -> 3 | F35: ="三期" -> 三期 | G35: ="C10001001" -> C10001001 | H35: ="车辆段" -> 车辆段 | I35: =" " ->  | J35: =" " ->  | K35: =" " ->  | L35: ="0352" -> 0352 | M35: ="电客车" -> 电客车 | N35: ="0352001" -> 0352001 | O35: ="电客车" -> 电客车 | P35: ="0352001001" -> 0352001001 | Q35: ="电客车" -> 电客车 | R35: 1 | S35: ="列" -> 列 | T35: ="Y" -> Y | U35: ="15049934" -> 15049934 | V35: ="电客车" -> 电客车 | W35: ="SFM46" -> SFM46 | X35: ="中车四方" -> 中车四方 | Y35: ="N" -> N | Z35: ="101D0075-2015-033-CG001" -> 101D0075-2015-033-CG001 | AA35: =" " ->  | AB35: =" " ->  | AC35: =" " -> 
A36: 1001679488 | B36: 10735 | C36: ="10" -> 10 | D36: ="10号线" -> 10号线 | E36: ="3" -> 3 | F36: ="三期" -> 三期 | G36: ="C10001001" -> C10001001 | H36: ="车辆段" -> 车辆段 | I36: =" " ->  | J36: =" " ->  | K36: =" " ->  | L36: ="0352" -> 0352 | M36: ="电客车" -> 电客车 | N36: ="0352001" -> 0352001 | O36: ="电客车" -> 电客车 | P36: ="0352001001" -> 0352001001 | Q36: ="电客车" -> 电客车 | R36: 1 | S36: ="列" -> 列 | T36: ="Y" -> Y | U36: ="15049934" -> 15049934 | V36: ="电客车" -> 电客车 | W36: ="SFM46" -> SFM46 | X36: ="中车四方" -> 中车四方 | Y36: ="N" -> N | Z36: ="101D0075-2015-033-CG001" -> 101D0075-2015-033-CG001 | AA36: =" " ->  | AB36: =" " ->  | AC36: =" " -> 
A37: 1001679489 | B37: 10736 | C37: ="10" -> 10 | D37: ="10号线" -> 10号线 | E37: ="3" -> 3 | F37: ="三期" -> 三期 | G37: ="C10001001" -> C10001001 | H37: ="车辆段" -> 车辆段 | I37: =" " ->  | J37: =" " ->  | K37: =" " ->  | L37: ="0352" -> 0352 | M37: ="电客车" -> 电客车 | N37: ="0352001" -> 0352001 | O37: ="电客车" -> 电客车 | P37: ="0352001001" -> 0352001001 | Q37: ="电客车" -> 电客车 | R37: 1 | S37: ="列" -> 列 | T37: ="Y" -> Y | U37: ="15049934" -> 15049934 | V37: ="电客车" -> 电客车 | W37: ="SFM46" -> SFM46 | X37: ="中车四方" -> 中车四方 | Y37: ="N" -> N | Z37: ="102D0032-2017-026-CG003" -> 102D0032-2017-026-CG003 | AA37: =" " ->  | AB37: =" " ->  | AC37: =" " -> 
A38: 1001679490 | B38: 10737 | C38: ="10" -> 10 | D38: ="10号线" -> 10号线 | E38: ="3" -> 3 | F38: ="三期" -> 三期 | G38: ="C10001001" -> C10001001 | H38: ="车辆段" -> 车辆段 | I38: =" " ->  | J38: =" " ->  | K38: =" " ->  | L38: ="0352" -> 0352 | M38: ="电客车" -> 电客车 | N38: ="0352001" -> 0352001 | O38: ="电客车" -> 电客车 | P38: ="0352001001" -> 0352001001 | Q38: ="电客车" -> 电客车 | R38: 1 | S38: ="列" -> 列 | T38: ="Y" -> Y | U38: ="15049934" -> 15049934 | V38: ="电客车" -> 电客车 | W38: ="SFM46" -> SFM46 | X38: ="中车四方" -> 中车四方 | Y38: ="N" -> N | Z38: ="102D0032-2017-026-CG003" -> 102D0032-2017-026-CG003 | AA38: =" " ->  | AB38: =" " ->  | AC38: =" " -> 
A39: 1001679491 | B39: 10738 | C39: ="10" -> 10 | D39: ="10号线" -> 10号线 | E39: ="3" -> 3 | F39: ="三期" -> 三期 | G39: ="C10001001" -> C10001001 | H39: ="车辆段" -> 车辆段 | I39: =" " ->  | J39: =" " ->  | K39: =" " ->  | L39: ="0352" -> 0352 | M39: ="电客车" -> 电客车 | N39: ="0352001" -> 0352001 | O39: ="电客车" -> 电客车 | P39: ="0352001001" -> 0352001001 | Q39: ="电客车" -> 电客车 | R39: 1 | S39: ="列" -> 列 | T39: ="Y" -> Y | U39: ="15049934" -> 15049934 | V39: ="电客车" -> 电客车 | W39: ="SFM46" -> SFM46 | X39: ="中车四方" -> 中车四方 | Y39: ="N" -> N | Z39: ="102D0032-2017-026-CG003" -> 102D0032-2017-026-CG003 | AA39: =" " ->  | AB39: =" " ->  | AC39: =" " -> 
A40: 1001679492 | B40: 10739 | C40: ="10" -> 10 | D40: ="10号线" -> 10号线 | E40: ="3" -> 3 | F40: ="三期" -> 三期 | G40: ="C10001001" -> C10001001 | H40: ="车辆段" -> 车辆段 | I40: =" " ->  | J40: =" " ->  | K40: =" " ->  | L40: ="0352" -> 0352 | M40: ="电客车" -> 电客车 | N40: ="0352001" -> 0352001 | O40: ="电客车" -> 电客车 | P40: ="0352001001" -> 0352001001 | Q40: ="电客车" -> 电客车 | R40: 1 | S40: ="列" -> 列 | T40: ="Y" -> Y | U40: ="15049934" -> 15049934 | V40: ="电客车" -> 电客车 | W40: ="SFM46" -> SFM46 | X40: ="中车四方" -> 中车四方 | Y40: ="N" -> N | Z40: ="102D0032-2017-026-CG003" -> 102D0032-2017-026-CG003 | AA40: =" " ->  | AB40: =" " ->  | AC40: =" " -> 
A41: 1001679493 | B41: 10740 | C41: ="10" -> 10 | D41: ="10号线" -> 10号线 | E41: ="3" -> 3 | F41: ="三期" -> 三期 | G41: ="C10001001" -> C10001001 | H41: ="车辆段" -> 车辆段 | I41: =" " ->  | J41: =" " ->  | K41: =" " ->  | L41: ="0352" -> 0352 | M41: ="电客车" -> 电客车 | N41: ="0352001" -> 0352001 | O41: ="电客车" -> 电客车 | P41: ="0352001001" -> 0352001001 | Q41: ="电客车" -> 电客车 | R41: 1 | S41: ="列" -> 列 | T41: ="Y" -> Y | U41: ="15049934" -> 15049934 | V41: ="电客车" -> 电客车 | W41: ="SFM46" -> SFM46 | X41: ="中车四方" -> 中车四方 | Y41: ="N" -> N | Z41: ="102D0032-2017-026-CG003" -> 102D0032-2017-026-CG003 | AA41: =" " ->  | AB41: =" " ->  | AC41: =" " -> 
A42: 1001679494 | B42: 10741 | C42: ="10" -> 10 | D42: ="10号线" -> 10号线 | E42: ="3" -> 3 | F42: ="三期" -> 三期 | G42: ="C10001001" -> C10001001 | H42: ="车辆段" -> 车辆段 | I42: =" " ->  | J42: =" " ->  | K42: =" " ->  | L42: ="0352" -> 0352 | M42: ="电客车" -> 电客车 | N42: ="0352001" -> 0352001 | O42: ="电客车" -> 电客车 | P42: ="0352001001" -> 0352001001 | Q42: ="电客车" -> 电客车 | R42: 1 | S42: ="列" -> 列 | T42: ="Y" -> Y | U42: ="15049934" -> 15049934 | V42: ="电客车" -> 电客车 | W42: ="SFM46" -> SFM46 | X42: ="中车四方" -> 中车四方 | Y42: ="N" -> N | Z42: ="102D0032-2017-026-CG003" -> 102D0032-2017-026-CG003 | AA42: =" " ->  | AB42: =" " ->  | AC42: =" " -> 
A43: 1001679495 | B43: 10742 | C43: ="10" -> 10 | D43: ="10号线" -> 10号线 | E43: ="3" -> 3 | F43: ="三期" -> 三期 | G43: ="C10001001" -> C10001001 | H43: ="车辆段" -> 车辆段 | I43: =" " ->  | J43: =" " ->  | K43: =" " ->  | L43: ="0352" -> 0352 | M43: ="电客车" -> 电客车 | N43: ="0352001" -> 0352001 | O43: ="电客车" -> 电客车 | P43: ="0352001001" -> 0352001001 | Q43: ="电客车" -> 电客车 | R43: 1 | S43: ="列" -> 列 | T43: ="Y" -> Y | U43: ="15049934" -> 15049934 | V43: ="电客车" -> 电客车 | W43: ="SFM46" -> SFM46 | X43: ="中车四方" -> 中车四方 | Y43: ="N" -> N | Z43: ="102D0032-2017-026-CG003" -> 102D0032-2017-026-CG003 | AA43: =" " ->  | AB43: =" " ->  | AC43: =" " -> 
A44: 1001679496 | B44: 10743 | C44: ="10" -> 10 | D44: ="10号线" -> 10号线 | E44: ="3" -> 3 | F44: ="三期" -> 三期 | G44: ="C10001001" -> C10001001 | H44: ="车辆段" -> 车辆段 | I44: =" " ->  | J44: =" " ->  | K44: =" " ->  | L44: ="0352" -> 0352 | M44: ="电客车" -> 电客车 | N44: ="0352001" -> 0352001 | O44: ="电客车" -> 电客车 | P44: ="0352001001" -> 0352001001 | Q44: ="电客车" -> 电客车 | R44: 1 | S44: ="列" -> 列 | T44: ="Y" -> Y | U44: ="15049934" -> 15049934 | V44: ="电客车" -> 电客车 | W44: ="SFM46" -> SFM46 | X44: ="中车四方" -> 中车四方 | Y44: ="N" -> N | Z44: ="102D0032-2017-026-CG003" -> 102D0032-2017-026-CG003 | AA44: =" " ->  | AB44: =" " ->  | AC44: =" " -> 
A45: 1001679497 | B45: 10744 | C45: ="10" -> 10 | D45: ="10号线" -> 10号线 | E45: ="3" -> 3 | F45: ="三期" -> 三期 | G45: ="C10001001" -> C10001001 | H45: ="车辆段" -> 车辆段 | I45: =" " ->  | J45: =" " ->  | K45: =" " ->  | L45: ="0352" -> 0352 | M45: ="电客车" -> 电客车 | N45: ="0352001" -> 0352001 | O45: ="电客车" -> 电客车 | P45: ="0352001001" -> 0352001001 | Q45: ="电客车" -> 电客车 | R45: 1 | S45: ="列" -> 列 | T45: ="Y" -> Y | U45: ="15049934" -> 15049934 | V45: ="电客车" -> 电客车 | W45: ="SFM46" -> SFM46 | X45: ="中车四方" -> 中车四方 | Y45: ="N" -> N | Z45: ="102D0032-2017-026-CG003" -> 102D0032-2017-026-CG003 | AA45: =" " ->  | AB45: =" " ->  | AC45: =" " -> 
A46: 1001679498 | B46: 10745 | C46: ="10" -> 10 | D46: ="10号线" -> 10号线 | E46: ="3" -> 3 | F46: ="三期" -> 三期 | G46: ="C10001001" -> C10001001 | H46: ="车辆段" -> 车辆段 | I46: =" " ->  | J46: =" " ->  | K46: =" " ->  | L46: ="0352" -> 0352 | M46: ="电客车" -> 电客车 | N46: ="0352001" -> 0352001 | O46: ="电客车" -> 电客车 | P46: ="0352001001" -> 0352001001 | Q46: ="电客车" -> 电客车 | R46: 1 | S46: ="列" -> 列 | T46: ="Y" -> Y | U46: ="15049934" -> 15049934 | V46: ="电客车" -> 电客车 | W46: ="SFM46" -> SFM46 | X46: ="中车四方" -> 中车四方 | Y46: ="N" -> N | Z46: ="102D0032-2017-026-CG003" -> 102D0032-2017-026-CG003 | AA46: =" " ->  | AB46: =" " ->  | AC46: =" " -> 